|S69-31062|ap11-S69-31062HR.jpg||Buzz joins Neil for the training session. Note that Buzz does not have a camera bracket on his RCU. 15 or 18 April 1969 Scan courtesy NASA Johnson.|
|S69-31063|ap11-S69-31063HR.jpg||Buzz and Neil (background) at the MESA) Note the tie-down strap hanging down from just below Buzz's RCU and the snap hook at the bottom of the strap. Note, also, the checklist fastened to Buzz's left gauntlet. 15 or 18 April 1969 Scan courtesy NASA Johnson.|
|S69-31064|ap11-S69-31064HR.jpg||Mike Collins prior to centrifuge training. 14 April 1969, Scan courtesy NASA Johnson.|
|S69-31065|ap11-S69-31065HR.jpg||Mike Collins prior to centrifuge training. Scan courtesy NASA Johnson.|
|S69-31066|ap11-S69-31066HR.jpg||Mike Collins prior to centrifuge training. Scan courtesy NASA Johnson.|
|S69-31067|ap11-S69-31067HR.jpg||Mike Collins during centrifuge training. Scan courtesy NASA Johnson.|
|S69-31068|ap11-S69-31068HR.jpg||Mike Collins during centrifuge training. Scan courtesy NASA Johnson.|
|S69-31069|ap11-S69-31069HR.jpg||Mike Collins during centrifuge training. Scan courtesy NASA Johnson.|
|S69-31070|ap11-S69-31070HR.jpg||Mike Collins during centrifuge training. Scan courtesy Mike Gentry, Jody Russell, and Kathy Strawn, NASA Johnson.|
|S69-31071|ap11-S69-31071HR.jpg||Mike Collins from above during centrifuge training. Scan courtesy NASA Johnson.|
|S69-31072|ap11-S69-31072HR.jpg||Mike Collins from above during centrifuge training. Scan courtesy NASA Johnson.|
|S69-31073|ap11-S69-31073HR.jpg||Buzz Aldrin works at the MESA during training. 15 or 18 April 1969 Scan courtesy NASA Johnson.|
|S69-31074|ap11-S69-31074HR.jpg||Neil (foreground) and Buzz at the MESA during training. 15 or 18 April 1969 Scan courtesy NASA Johnson.|
|S69-31075|ap11-S69-31075HR.jpg||Neil places a rock box on the MESA table. Journal Contributor Ed Hengeveld notes that Owen Garriott is immediately beyond Neil, wearing a tie but no jacket. 15 or 18 April 1969 Scan courtesy NASA Johnson.|
|S69-31076|ap11-S69-31076HR.jpg||Neil opens the rock box. An extension handle is sticking out below is right hand. 15 or 18 April 1969 Scan courtesy NASA Johnson.|
|S69-31077|ap11-S69-31077HR.jpg||Neil collects a soil sample with the large, box scoop. Note the weigh bag attached to the near corner of the MESA. 15 or 18 April 1969 Scan courtesy NASA Johnson.|
|S69-31078|ap11-S69-31078HR.jpg||Neil pours the soil sample in the weigh bag. 15 or 18 April 1969 Scan courtesy NASA Johnson.|
|S69-31079|ap11-S69-31079HR.jpg||Neil closes the rock box, probably with the weigh bag inside, while Buzz watches. 15 or 18 April 1969 Scan courtesy NASA Johnson.|
|S69-31080|ap11-S69-31080HR.jpg||"This training photo shows Neil closing the righthand latch on rock box at the MESA table. Note the ETB on the near corner of the table and the tool handle sticking out of it. Photo dated 18 April 1969. The <a href=""A11CrewTraining.html"" target=""new"">training session</a> was almost certainly on 15 April 1969. Research by Paolo Dangelo. Scan courtesy NASA Johnson."|
|S69-31081|ap11-S69-31081HR.jpg||Neil (left) and Buzz during training. Note that Buzz is wearing the RCU camera bracket and an attached camera. A person in the background seems to be checking out the high-gain antenna. 15 or 18 April 1969 Scan courtesy NASA Johnson.|
|S69-31082|ap11-S69-31082HR.jpg||Neil near the LM mockup with the Solar Wind Collector on the righthand edge of the image. 15 or 18 April 1969 Scan courtesy NASA Johnson.|
|S69-31083|ap11-S69-31083HR.jpg||Buzz has the seismometer on the surface after removing it from the Scientific Equipment (SEQ) Bay. The Lunar Ranging Retro Reflector (LRRR or LR-Cubed) is still in the bay. 15 or 18 April 1969 Scan courtesy Mike Gentry, Jody Russell, and Kathy Strawn, NASA Johnson.|
|S69-31087|ap11-S69-31087HR.jpg||Close-up side view of Neil wearing a camera on his RCU camera bracket. Good detail of his LEVA tabs. 15 or 18 April 1969 Scan courtesy NASA Johnson.|
|S69-31088|ap11-S69-31088HR.jpg||Close-up front view of Buzz during training, with the LM mock-up reflected in his face plate. Good detail of his microphones and LEVA tabs. 15 or 18 April 1969 Research by J.L. Pickering. Scan courtesy NASA Johnson.|
|S69-31089|ap11-S69-31089HR.jpg||Close-up front view of Buzz at the ladder. 15 or 18 April 1969 Scan courtesy NASA Johnson.|
|S69-31091|ap11-S69-31091HR.jpg||Neil works with the rock box at the MESA. Deke Slayton is in the background in dark jacket, tie, and dark glasses. 15 or 18 April 1969 Scan courtesy NASA Johnson.|
|S69-31092|ap11-S69-31092HR.jpg||Neil works with the rock box at the MESA. Deke Slayton is in the background in dark jacket, tie, and dark glasses. 15 or 18 April 1969 Scan courtesy NASA Johnson.|
|S69-31093|ap11-S69-31093.jpg||"Buzz during suited <a href=""A11CrewTraining.html"" target=""new"">training</a>. 15 or 18 April 1969 Scan by J.L. Pickering."|
|S69-31098|ap11-S69-31098HR.jpg||"Neil uses the Lunar Equipment Conveyor (<a href=""..alsj-lec.html"" target=""new"">LEC</a>) to send a mock-up of a rock box up to the cabin. The rock box he was working with previously during this training session is still on the MESA table. 15 or 18 April 1969 Scan courtesy NASA Johnson."|
|S69-31099|ap11-S69-31099HR.jpg||Neil uses the Lunar Equipment Conveyor (LEC) to send a mock-up of a rock box up to the cabin. 15 or 18 April 1969 Scan courtesy NASA Johnson.|
|S69-31101|ap11-S69-31101HR.jpg||Neil uses the Lunar Equipment Conveyor (LEC) to send a mock-up of a rock box up to the cabin. 15 or 18 April 1969 Scan courtesy Mike Gentry, Jody Russell, and Kathy Strawn, NASA Johnson.|
|S69-31102|ap11-S69-31102HR.jpg||Neil uses the Lunar Equipment Conveyor (LEC) to send a mock-up of a rock box up to the cabin. 15 or 18 April 1969 Scan courtesy NASA Johnson.|
|S69-31103|ap11-S69-31103HR.jpg||Neil uses the Lunar Equipment Conveyor (LEC) to send a mock-up of a rock box up to the cabin. 15 or 18 April 1969 Scan courtesy NASA Johnson.|
|S69-31104|ap11-S69-31104HR.jpg||Neil gets a rest. Research by J.L. Pickering. 15 or 18 April 1969 Scan courtesy NASA Johnson.|
|S69-31105|ap11-S69-31105HR.jpg||Neil works at the MESA while Buzz takes a plus-Y pan. On the Moon, this will be north of the spacecraft. 15 or 18 April 1969 Scan courtesy NASA Johnson.|
|S69-31106|ap11-S69-31106HR.jpg||Neil works at the MESA while Buzz takes a plus-Y pan. On the Moon, this will be north of the spacecraft. 15 or 18 April 1969 Scan courtesy NASA Johnson.|
|S69-31107|ap11-S69-31107HR.jpg||Neil works at the MESA while Buzz takes a plus-Y pan. On the Moon, this will be north of the spacecraft. 15 or 18 April 1969 Scan courtesy NASA Johnson.|
|S69-31108|ap11-S69-31108HR.jpg||"Buzz continues a plus-Y during <a href=""A11CrewTraining.html"" target=""new"">training</a>. 15 or 18 April 1969 Note that the camera doesn't appear to have the trigger assembly of the silver-colored EVA camera. Compare with <a href=""#KSC69PC362"" target=""new"">KSC-69PC-362</a>. 15 or 18 April 1969 Research by J.L. Pickering. Scan courtesy NASA Johnson."|
|S69-31109|ap11-S69-31109HR.jpg||Neil works at the MESA while Buzz takes a plus-Y pan. On the Moon, this will be north of the spacecraft. 15 or 18 April 1969 Scan courtesy NASA Johnson.|
|S69-31110|ap11-S69-31110HR.jpg||A technician works on Buzz's PLSS at left. Neil, on the right, would not be able to lean as far forward on the Moon without support. 15 or 18 April 1969 Scan courtesy NASA Johnson.|
|S69-31111|ap11-S69-31111HR.jpg||Buzz (left) and Neil during training. 15 or 18 April 1969 Scan courtesy NASA Johnson.|
|S69-31112|ap11-S69-31112HR.jpg||Buzz prepares to remove the seismometer from the Scientific Equipment (SEQ) Bay. 15 or 18 April 1969 Scan courtesy Mike Gentry, Jody Russell, and Kathy Strawn, NASA Johnson.|
|S69-31113|ap11-S69-31113HR.jpg||Buzz (left) with the seismometer and Neil (right) with the LRRR. During the mission, Buzz carried both packages away from the LM while Neil followed behind taking pictures. 15 or 18 April 1969 Scan courtesy NASA Johnson.|
|S69-31114|ap11-S69-31114HR.jpg||The fully deployed seismometer is in the foreground with the LRRR beyond it near Buzz. Neil is on the right. They both appear to be resting. The SWC is near the far edge of the training area at center. 15 or 18 April 1969 Scan courtesy NASA Johnson.|
|S69-31115|ap11-S69-31115HR.jpg||Buzz is about to unstow the rockbox while Neil watches from the foreground. 15 or 18 April 1969 Scan courtesy NASA Johnson.|
|S69-31116|ap11-S69-31116HR.jpg||Buzz is about to open the rock box so he can remove the core tubes. 15 or 18 April 1969 Scan courtesy NASA Johnson.|
|S69-31117|ap11-S69-31117HR.jpg||Neil (left) watches Buzz open the rock box. 15 or 18 April 1969 Scan courtesy NASA Johnson.|
|S69-31118|ap11-S69-31118HR.jpg||Neil (left) watches Buzz remove weigh bags and other contents of the rock box so he can get at the core tubes. 15 or 18 April 1969 Scan courtesy NASA Johnson.|
|S69-31119|ap11-S69-31119HR.jpg||Neil (left) watches Buzz remove the contents of the rock box. 15 or 18 April 1969 Scan courtesy NASA Johnson.|
|S69-31120|ap11-S69-31120HR.jpg||Neil (rear) takes a documentation photo of the core tube Buzz has driven into the surface. 15 or 18 April 1969 Scan courtesy NASA Johnson.|
|S69-31121|ap11-S69-31121HR.jpg||Neil (rear) watches Buzz remove the core tube. 15 or 18 April 1969 The SWC is on the left. Scan courtesy NASA Johnson.|
|S69-31122|ap11-S69-31122HR.jpg||Neil (left) and Buzz practice collecting documented samples. Neil has a weigh bag attached at his waist and is holding an individual sample bag while Buzz prepares to use the tongs. There is a gnomon on the surface between them and the large, box scoop just beyond it. During the Apollo 11 EVA, Neil and Buzz rain out of time before they could do any documented sampling. 15 or 18 April 1969 Scan courtesy NASA Johnson.|
|S69-31123|ap11-S69-31123HR.jpg||Buzz (right) uses the tongs to collect a small rock while Neil holds open an individual sample bag. 15 or 18 April 1969 Scan courtesy Mike Gentry, Jody Russell, and Kathy Strawn, NASA Johnson.|
|S69-31124|ap11-S69-31124HR.jpg||Neil holds out an individual sample bag to receive the rock Buzz has in his tongs. 15 or 18 April 1969 Scan courtesy NASA Johnson.|
|S69-31125|ap11-S69-31125HR.jpg||Buzz (right) collects a sample with the tongs. 15 or 18 April 1969 Scan courtesy NASA Johnson.|
|S69-31126|ap11-S69-31126HR.jpg||Buzz (right) prepares to drop a sample from the tongs into an individual sample bag Neil is holding open for him. On the Moon, they would not have been able to bend the suits as much as they could in terrestrial gravity. 15 or 18 April 1969 Scan courtesy NASA Johnson.|
|S69-31127|ap11-S69-31127HR.jpg||Neil (left) takes a documentation photo of the sampling area. 15 or 18 April 1969 Scan courtesy NASA Johnson.|
|S69-31128|ap11-S69-31128HR.jpg||Buzz (foreground) drops a rock sample in an individual sample bag Neil is holding open for him. Neil is wearing a weigh bag clipped at his waist and has a pack of sample bags clipped to the top of the weight bag. 15 or 18 April 1969 Scan courtesy NASA Johnson.|
|S69-31129|ap11-S69-31129HR.jpg||Buzz (foreground) drops a rock sample in an individual sample bag Neil is holding open for him. Neil is wearing a weigh bag clipped at his waist and has a pack of sample bags clipped to the top of the weight bag. 15 or 18 April 1969 Scan courtesy NASA Johnson.|
|S69-31130|ap11-S69-31130HR.jpg||Buzz (right) pours a soil sample into an individual sample bag. 15 or 18 April 1969 Scan courtesy NASA Johnson.|
|S69-31131|ap11-S69-31131HR.jpg||Neil (left) holds an individual sample bag containing a small quantity of soil. 15 or 18 April 1969 Buzz has the large, box scoop. Scan courtesy NASA Johnson.|
|S69-31132|ap11-S69-31132HR.jpg||Neil (left) drops the soil sample bag in the weigh bag. Buzz has the large, box scoop. 15 or 18 April 1969 Scan courtesy NASA Johnson.|
|S69-31133|ap11-S69-31133HR.jpg||Neil (right) and Buzz at the MESA after the documented sampling. 15 or 18 April 1969 Scan courtesy NASA Johnson.|
|S69-31134|ap11-S69-31134HR.jpg||Neil (right) and Buzz at the MESA after the documented sampling. 15 or 18 April 1969 Scan courtesy NASA Johnson.|
|S69-31135|ap11-S69-31135HR.jpg||Buzz (right) collecting a soil sample with the large, box scoop. 15 or 18 April 1969 Scan courtesy NASA Johnson.|
|S69-31136|ap11-S69-31136HR.jpg||Buzz (right) collecting a soil sample with the large, box scoop. Neil may be taking a documentation photo. 15 or 18 April 1969 Scan courtesy NASA Johnson.|
|S69-31137|ap11-S69-31137HR.jpg||Neil (right) and Buzz at the MESA. The Lunar Equipment Transfer Bag is hanging from the near corner of the MESA. 15 or 18 April 1969 Scan courtesy NASA Johnson.|
|S69-31138|ap11-S69-31138HR.jpg||"Neil (left) is holding the Small Environmental Sample Container into which Buzz will put a small rock. LIke the documented sampling, this task was not done during the mission due to lack of time. 15 or 18 April 1969 A detail ( <a href=""a11detS69-31138.jpg"" title=""image"" target=""new"">126k</a> ) zooms in on the container. Scan courtesy NASA Johnson."|
|S69-31139|ap11-S69-31139HR.jpg||Neil (foreground) packs the rock box. 15 or 18 April 1969 Scan courtesy Mike Gentry, Jody Russell, and Kathy Strawn, NASA Johnson.|
|S69-31140|ap11-S69-31140HR.jpg||Neil packs the rock box while Buzz retrieves the Solar Wind Collector (SWC) in the background. 15 or 18 April 1969 Scan courtesy NASA Johnson.|
|S69-31141|ap11-S69-31141HR.jpg||Buzz photographed from behind the ladder. 15 or 18 April 1969 Scan courtesy NASA Johnson.|
|S69-31142|ap11-S69-31142HR.jpg||Neil uses the Lunar Equipment Conveyor (LEC). Note that the MESA is covered with its thermal blankets. 15 or 18 April 1969 Scan courtesy NASA Johnson.|
|S69-31143|ap11-S69-31143HR.jpg||Neil uses the Lunar Equipment Conveyor (LEC) to transfer what is probably a camera down from the cabin. 15 or 18 April 1969 Scan courtesy NASA Johnson.|
|S69-31144|ap11-S69-31144HR.jpg||Neil appears to be discussing the camera transfer with someone off-camera to the right. 15 or 18 April 1969 Note that the LEC straps are now outside the porch rail on the MESA side. Scan courtesy NASA Johnson.|
|S69-31145|ap11-S69-31145HR.jpg||Neil has started walking toward the camera, moving his hands along the straps while maintaining some tension. 15 or 18 April 1969 Scan courtesy NASA Johnson.|
|S69-31146|ap11-S69-31146HR.jpg||Neil now has the camera on his RCU bracket. Note the tech sitting in the LM hatch. He was undoubtedly in the cabin playing Buzz's role in the camera transfer. 15 or 18 April 1969 Scan courtesy NASA Johnson.|
|S69-31147|ap11-S69-31147HR.jpg||Neil walks off the training surface, still wearing the camera. 15 or 18 April 1969 Scan courtesy NASA Johnson.|
|S69-31148|ap11-S69-31148HR.jpg||Neil with the package containing the deployable S-Band antenna. He would have done the deployment during the mission if the signal thru the LM antenna had been unacceptable. It was adequate, so this time-consuming task was skipped. Here's Neil may be looking at a procedures decal on the top plate. 15 or 18 April 1969 Scans courtesy NASA Johnson.|
|S69-31149|ap11-S69-31149HR.jpg||Similar to 31148. 15 or 18 April 1969 Scans courtesy NASA Johnson.|
|S69-31150|ap11-S69-31150HR.jpg||Neil is removing a cover plate from the top of the package. 15 or 18 April 1969 Scans courtesy NASA Johnson.|
|S69-31151|ap11-S69-31151HR.jpg||Neil has the restraining ring in his right hand and is going to discard it. 15 or 18 April 1969 Scan courtesy NASA Johnson.|
|S69-31152|ap11-S69-31152HR.jpg||Neil raises the receiver/transmitter mast of the deployable S-Band antenna. 15 or 18 April 1969 Scans courtesy NASA Johnson.|
|S69-31153|ap11-S69-31153HR.jpg||Neil is about the extend one of the three telescoping legs. 15 or 18 April 1969 Scan courtesy NASA Johnson.|
|S69-31154|ap11-S69-31154HR.jpg||Neil is raising the third leg, which is mostly hidden behind the mast. Next he will removed restraining strap and let the legs swing outwards on pivots at the bottom of the package until they are lying on the surface. 15 or 18 April 1969 Scans courtesy Mike Gentry, Jody Russell, and Kathy Strawn, NASA Johnson.|
|S69-31155|ap11-S69-31155HR.jpg||Neil has all three legs deployed and is lifting the main body until the legs come inward toward the locked position. Note that the entire package has a lunar weight of only 1 kg. 15 or 18 April 1969 Scan courtesy NASA Johnson.|
|S69-31156|ap11-S69-31156HR.jpg||Neil has raised the S-Band antenna higher, bringing the legs farther inward . 15 or 18 April 1969 Scanss courtesy NASA Johnson.|
|S69-31157|ap11-S69-31157HR.jpg||Similar to 31156. 15 or 18 April 1969 Scan courtesy NASA Johnson.|
|S69-31158|ap11-S69-31158HR.jpg||Neil now has the antenna raised to full height, with the legs in their final configuration. 15 or 18 April 1969 Scan courtesy NASA Johnson.|
|S69-31159|ap11-S69-31159HR.jpg||"Neil is removing a rib protector that bound the umbrella ribs at the bottom. See, also, a <a href=""a11detS69-31159.jpg"" title=""image"" target=""new"">detail</a>. Neil will let the rib protector slide down the leg on our right. In the foreground, the carry bar lies on top of the umbrella cover. 15 or 18 April 1969 Scan courtesy NASA Johnson."|
|S69-31160|ap11-S69-31160HR.jpg||The rib protector can be seen wrapped around the bottom on the leg at the lower right. Neil is releasing the trigger lanyard. 15 or 18 April 1969 Scan courtesy NASA Johnson.|
|S69-31161|ap11-S69-31161HR.jpg||Neil has the trigger lanyard. When used, the trigger will release the strap warpped around the middle of the umbrella, allowing it to spring open. 15 or 18 April 1969 Scan courtesy NASA Johnson.|
|S69-31162|ap11-S69-31162HR.jpg||"Neil has pulled the release cord. Note that Neil is holding one of the legs with his left hand, undoubtedly to keep the antenna from jumping and, possibly, tipping over, in reaction to the umbrella springing open. As Pete Conrad told the press during a post-Apollo 12 news conferenced, ""I know many of you've seen it deployed in practice. It said on the instructions (that) when you deploy it, it unfolds and springs out. But it (also) said (to) hold on to the leg; and I really didn't hold on to the leg too well; and, when I deployed it, it jumped about 4 feet in the air."" Ulli Lotzmann has sketched the scene ( <a href=""../UL12Higher.jpg"" title=""sketch"" target=""new"">227k</a> ). 15 or 18 April 1969 Scan courtesy NASA Johnson."|
|S69-31163|ap11-S69-31163HR.jpg||Neil with the S-Band antenna now open. 15 or 18 April 1969 Scan courtesy NASA Johnson.|
|S69-31164|ap11-S69-31164HR.jpg||Neil at the MESA with the S-Band cable. Note that his Hasselblad is mounted to an RCU mock-up. 15 or 18 April 1969 Scan courtesy NASA Johnson.|
|S69-31165|ap11-S69-31165HR.jpg||"Neil at the S-Band antenna. A <a href=""a11detS69-31165.jpg"" title=""image"" target=""new"">detail</a> shows the sighting glass and crank. A <a href=""a11detBS69-31165.jpg"" title=""image"" target=""new"">second detail</a> shows the rib protector on the surface. 15 or 18 April 1969 Scan courtesy NASA Johnson."|
|S69-31166|ap11-S69-31166HR.jpg||Buzz during suited EVA training in MSC Building 9. 15 or 18 April 1969 Scan courtesy NASA Johnson.|
|S69-31167|ap11-S69-31167HR.jpg||Buzz during suited EVA training in MSC Building 9. 15 or 18 April 1969 Scan courtesy NASA Johnson.|
|S69-31168|ap11-S69-31168HR.jpg||Neil, wearing PLSS mockup No.26, at the MESA, with Buzz beyond him. 15 or 18 April 1969 Scan courtesy NASA Johnson.|
|S69-31169|ap11-S69-31169HR.jpg||Neil at the MESA. Buzz is hidden behind Neil, being tended by technicians. 15 or 18 April 1969 Scan courtesy NASA Johnson.|
|S69-31170|ap11-S69-31170HR.jpg||Buzz in the foreground. Note that his RCU does not have a camera bracket of front. In the background, Neil has placed the TV on it's tripod. 15 or 18 April 1969 Scan courtesy NASA Johnson.|
|S69-31171|ap11-S69-31171HR.jpg||Neil has moved the TV to the end of the cable connecting to the spacecraft and off the simulated lunar surface. In the background, Buzz is working at the MESA. 15 or 18 April 1969 Scan courtesy NASA Johnson.|
|S69-31172|ap11-S69-31172HR.jpg||Buzz is at the MESA holding the extendible staff for the Solar Wind Collector (SWC). Note that he has a tiedown strap and snjap hook hanging down from beneath his RCU. Other photos show that this was to be used to secure the Hasselblad camera with Buzz had it. 15 or 18 April 1969 Scan courtesy NASA Johnson.|
|S69-31173|ap11-S69-31173HR.jpg||Buzz with the SWC assembled. 15 or 18 April 1969 Scan courtesy NASA Johnson.|
|S69-31174|ap11-S69-31174HR.jpg||Buzz with the SWC staff pushed into the surface. 15 or 18 April 1969 Scan courtesy Mike Gentry, Jody Russell, and Kathy Strawn, NASA Johnson.|
|S69-31175|ap11-S69-31175HR.jpg||"On the Moon, Buzz will orient the SWC so that the collector surface faces the Sun. In this indoor setting, he's has pointing it roughly toward minus-Z. As can be seen in mission photo AS11-40-<a href=""#5872"" target=""new"">5872</a>, the SWC that Buzz deployed on the Moon had the word 'Sun' printed on the bottom of the sunward side and 'Shade' on the back. This training unit is not marked. 15 or 18 April 1969 Scan courtesy NASA Johnson."|
|S69-31176|ap11-S69-31176HR.jpg||Neil at the MESA with the rockbox open on its 'table'. 15 or 18 April 1969 Scan courtesy NASA Johnson.|
|S69-31177|ap11-S69-31177HR.jpg||Neil collects the Bulk Sample with the large scoop. 15 or 18 April 1969 Scan courtesy NASA Johnson.|
|S69-31178|ap11-S69-31178HR.jpg||Motion blurred photo of Neil with the S-Band antenna. The umbrella cover is on the right with the carry bar on top. The rib protector rings the far leg. The photographer may be from Aviation Week and Space Technology. 15 or 18 April 1969 Scan courtesy NASA Johnson.|
|S69-31179|ap11-S69-31179HR.jpg||Neil practices alignment of the S-Band antenna. He appears to be turning the crank barrel with his right hand. 15 or 18 April 1969 Scan courtesy NASA Johnson.|
|S69-31180|ap11-S69-31180HR.jpg||Neil and Buzz seem to have swapped RCUs. Neil is on the left, facing us. Buzz is on the right wearing the RCU mockup with an attached Hasselblad. 15 or 18 April 1969 Scan courtesy NASA Johnson.|
|S69-31181|ap11-S69-31181HR.jpg||Neil (left) and Buzz at the ladder. Note that Neil isn't wearing a checklist and neither of them is wearing a watch. 15 or 18 April 1969 Scan courtesy NASA Johnson.|
|S69-31182|ap11-S69-31182HR.jpg||Buzz near the S-Band antenna. Buzz has a checklist attached to the gauntlet of his right glove. 15 or 18 April 1969 Scan courtesy NASA Johnson.|
|S69-31183|ap11-S69-31183HR.jpg||Neil (right) is working at the MESA. Buzz is in the background wearing the Hasselblad. 15 or 18 April 1969 Scan courtesy NASA Johnson.|
|S69-31184|ap11-S69-31184HR.jpg||Neil (foreground) is pulling a rock box out of the MESA. Buzz is in the background. 15 or 18 April 1969 Scan courtesy NASA Johnson.|
|S69-31185|ap11-S69-31185HR.jpg||Neil has opened the rock box and is removing wire mesh packing material. Photo S69-31205 (below) provides a better view of the mesh material. 15 or 18 April 1969 Scan courtesy NASA Johnson.|
|S69-31186|ap11-S69-31186HR.jpg||Neil has attached a spring scale to the near corner of the MESA and has a weigh bag in his left hand. Buzz is in the background, perhaps discussing photographic tasks with the person to his left. 15 or 18 April 1969 Scan courtesy NASA Johnson.|
|S69-31187|ap11-S69-31187HR.jpg||Neil has attached the weigh bag to the spring scale. Because earlier EVA activities took longer than planned, Neil never used the spring scale on the Moon. 15 or 18 April 1969 Scan courtesy NASA Johnson.|
|S69-31188|ap11-S69-31188HR.jpg||Neil has collected a 'sample' with the large scoop and is pouring it into the weigh bag. The SWC is in the foreground on the left. Something is hanging at the end of a lanyard attached to the porch. Perhaps a second Hasselblad? 15 or 18 April 1969 Scan courtesy NASA Johnson.|
|S69-31189|ap11-S69-31189HR.jpg||Neil with the large scoop. 15 or 18 April 1969 Scan courtesy NASA Johnson.|
|S69-31190|ap11-S69-31190HR.jpg||Neil appears to have collected another 'soil sample'. 15 or 18 April 1969 Scan courtesy Mike Gentry, Jody Russell, and Kathy Strawn, NASA Johnson.|
|S69-31191|ap11-S69-31191HR.jpg||Neil pours a 'sample' into the weigh bag. 15 or 18 April 1969 Scan courtesy NASA Johnson.|
|S69-31192|ap11-S69-31192HR.jpg||Neil pours a 'sample' into the weigh bag. 15 or 18 April 1969 Scan courtesy NASA Johnson.|
|S69-31193|ap11-S69-31193HR.jpg||Neil closes the rockbox. Buzz is in the background near the SWC. 15 or 18 April 1969 Scan courtesy NASA Johnson.|
|S69-31194|ap11-S69-31194HR.jpg||Buzz is in the foreground, perhaps watching Neil latching the rockbox. 15 or 18 April 1969 Scan courtesy NASA Johnson.|
|S69-31195|ap11-S69-31195HR.jpg||Neil is at the center of the image and Buzz is in the right foreground. The technician on the right is holding Buzz's comm cables, keeping them out of harm's way. 15 or 18 April 1969 Scan courtesy NASA Johnson.|
|S69-31196|ap11-S69-31196HR.jpg||Neil (left center) and Buzz (right) during an EVA runthrough. At some point before 31197 was taken, Neil and Buzz swapped RCUs, giving Neil the camera. Throughout this sequence, the Zipper cover over Neil's groin has been partly open, allowing us to identify him in this photo in which the PLSS numbers are not visible and Neil's face is turned down and to his left enough that he is not clearly identifiable. 15 or 18 April 1969 Scan courtesy NASA Johnson.|
